"","employers.id","employers.name","employers.website","employers.isEEP","employers.exactMatch","employers.industry","employers.numberOfRatings","employers.squareLogo","employers.overallRating","employers.ratingDescription","employers.cultureAndValuesRating","employers.seniorLeadershipRating","employers.compensationAndBenefitsRating","employers.careerOpportunitiesRating","employers.workLifeBalanceRating","employers.recommendToFriendRating","employers.featuredReview.id","employers.featuredReview.currentJob","employers.featuredReview.reviewDateTime","employers.featuredReview.jobTitle","employers.featuredReview.location","employers.featuredReview.jobTitleFromDb","employers.featuredReview.headline","employers.featuredReview.pros","employers.featuredReview.cons","employers.featuredReview.overall","employers.featuredReview.overallNumeric","employers.ceo.name","employers.ceo.title","employers.ceo.numberOfRatings","employers.ceo.pctApprove","employers.ceo.pctDisapprove"
"38",432,"McDonald's","www.mcdonalds.com",TRUE,FALSE,"Fast-Food & Quick-Service Restaurants",4556,"https://media.glassdoor.com/sqll/432/mcdonald-s-squarelogo.png",3,"OK","2.9","2.7","2.4","2.9","3.0","0.5",6106222,TRUE,"2015-03-12 15:15:46.37","Scheduler","Guilderland, NY","Scheduler","Very Friendly, fast pace environment","The best part is being able to be yourself & be happy at work.","customers sometimes like to make you feel like you aren't anything only because you work at a fast food restaurant.",5,5,"Don Thompson","President & CEO",1329,67,33
"39",13604,"Citibank","www.citibank.com",FALSE,FALSE,"Investment Banking & Asset Management",1742,"https://media.glassdoor.com/sqll/13604/citibank-squarelogo.png",3.2,"OK","3.2","2.7","3.4","3.1","3.2","0.6",6032183,TRUE,"2015-03-02 17:47:39.283","Bank Teller","Lake Grove, NY","Bank Teller","Great benefits and compensation.","Their health benefits are top notch,the plans that they offer give you many different options, hard to beat their choices.","Turnover due to managements rigid way of doing things within branches is horrible, the turnover makes the customers unhappy, which makes our job harder.",3,3,"Michael Corbat","CEO",454,79,21
"40",4711,"Memorial Sloan Kettering","www.mskcc.org",TRUE,FALSE,"Health Care Services & Hospitals",312,"https://media.glassdoor.com/sqll/4711/memorial-sloan-kettering-squarelogo-1390842863514.png",4.1,"Very Satisfied","4.0","3.4","4.0","3.7","3.8","0.9",6040014,FALSE,"2015-03-03 16:52:44.827","Senior Analyst, Clinical Practice Plan","New York, NY","Senior Analyst, Clinical Practice Plan","Fantastic organization to start a career in healthcare.","Great benefits; driven coworkers that bring the best out of you; and many opportunities to grow.","As a very large organization, it is a bit intimidating at first. I came in as an RSA and eventually found my stride in the clinical practice plan.",5,5,"Craig B. Thompson","President & CEO",145,95,5
"41",715,"Walmart","corporate.walmart.com",TRUE,FALSE,"General Merchandise & Superstores",10167,"https://media.glassdoor.com/sqll/715/walmart-squarelogo-1408483474312.png",2.9,"OK","2.8","2.5","2.7","3.1","2.6","0.4",6112480,FALSE,"2015-03-13 13:53:15.267","Assistant Store Manager","Fishkill, NY","Assistant Store Manager","Great foundation. There are many process in place that in the perfect walmart world would work great.","High base pay. Benefits on day 1 of employment.","You will be spoken to and yell at as if you were a child.",3,3,"Doug McMillon","CEO",1735,50,50
"42",437,"CVS Health","www.cvshealth.com",TRUE,FALSE,"Health Care Services & Hospitals",3904,"https://media.glassdoor.com/sqll/437/cvs-caremark-squarelogo-1409741927278.png",2.6,"OK","2.7","2.3","2.7","2.7","2.5","0.4",6083628,FALSE,"2015-03-09 16:39:17.703","Shift Supervisor A","Port Jefferson Station, NY","Shift Supervisor A","Times they are a changin'","The in-store dynamic can be intricate and be a great place to work. Promotions are obtainable relatively easily. The work can be rewarding.","The company doesn't adequately value the effort of its store employees. Time-off is an issue for many periods throughout the year. Heavy workload with skeleton budgets. Serious disconnect between company initiatives and store needs.",3,3,"Larry J. Merlo","President and CEO",1443,42,58
"43",440,"Merrill Lynch","www.baml.com",TRUE,FALSE,"Brokerage Services",1302,"https://media.glassdoor.com/sqll/440/merrill-lynch-squarelogo.png",3.7,"Satisfied","3.5","3.4","3.4","3.5","3.6","0.8",6044215,TRUE,"2015-03-04 08:20:22.393","Investment Banking Analyst","New York, NY","Investment Banking Analyst","Fantastic investment banking experience","Entrepreneurial environment, staffed on interesting and high-profile transactions, Great Pay","Long hours and poor work/life balance",5,5,"Brian T. Moynihan","President & CEO of Bank of America",370,78,22
"44",258062,"HSBC Bank USA","www.us.hsbc.com",FALSE,FALSE,"",581,"https://media.glassdoor.com/sqll/258062/hsbc-bank-usa-squarelogo.png",3.1,"OK","3.0","2.7","3.3","3.0","3.5","0.5",6112353,FALSE,"2015-03-13 13:30:37.183","Premier Relationship Manager","New York, NY","Premier Relationship Manager","Premier Relationship Mgr","Base plus incentive and with good benefits. Good colleagues and clean work environment. International branding and well known in the market. They are very good at attracting a wealth customer and offering products to fit their needs.","A lot of prospecting and aggressive goals",4,4,"Irene Dorner","Chief Executive Officer",160,73,27
"45",3419,"UBS","www.ubs.com",FALSE,FALSE,"Investment Banking & Asset Management",1553,"https://media.glassdoor.com/sqll/3419/ubs-squarelogo-1383039022554.png",3.4,"OK","3.3","3.1","3.0","3.1","3.6","0.6",6064775,FALSE,"2015-03-06 12:33:59.133","Trader","New York, NY","Trader","It was a good place to work at but lacked communication internally","great place to start a career. People were very interested in mentoring and was able to have a lot of responsibilities early on.","Internally there was a lack of communication from mgmt to the rest of the team. 

Felt that producers were not fairly compensated at the appropriate times.",4,4,"Sergio P. Ermotti","CEO",336,80,20
"46",8360,"Condé Nast","www.condenast.com",FALSE,FALSE,"Publishing",293,"https://media.glassdoor.com/sqll/8360/condé-nast-squarelogo-1412700021543.png",3.6,"Satisfied","3.1","3.0","3.2","3.4","3.3","0.8",6097416,TRUE,"2015-03-11 12:24:37.353","Contributor","New York, NY","Contributor","Very happy","Good editors, fun environment, prestige publications, great exposure","I really can't think of any. This is a very solid organization that knows what it's doing, and pays well.",5,5,"Chuck Townsend","President and CEO",139,73,27
"47",4192,"Time","www.timeinc.com",FALSE,FALSE,"Publishing",288,"https://media.glassdoor.com/sqll/4192/time-squarelogo-1423168113584.png",3.2,"OK","3.0","2.7","3.3","2.9","3.7","0.6",6120259,TRUE,"2015-03-15 07:33:17.793","Employee","New York, NY",NA,"A great company in transition","Great co-workers, opportunities for advancement, constant learning opportunities, work/life balance, benefits","Job security, low morale, struggling through an enormous culture change",5,5,"Joseph A. Ripp","Chief Executive Officer",48,65,35
"48",2915,"New York Life","www.newyorklife.com",FALSE,FALSE,"Investment Banking & Asset Management",873,"https://media.glassdoor.com/sqll/2915/new-york-life-squarelogo.png",3.4,"OK","3.5","3.2","3.2","3.3","3.4","0.6",6076537,FALSE,"2015-03-08 19:08:15.053","Insurance Sales Agent","Queens Village, NY","Insurance Sales Agent","Not what they claim to be","they have earning potential and location","everything else is pretty crappy at this place",2,2,"Ted Mathas","Chairman, President & CEO",489,80,20
"49",522,"PepsiCo","www.pepsico.com",TRUE,FALSE,"Food & Beverage Manufacturing",2204,"https://media.glassdoor.com/sqll/522/pepsico-squarelogo.png",3.4,"OK","3.3","2.9","3.6","3.2","2.8","0.6",6072465,FALSE,"2015-03-07 22:23:37.913","Intern","New York, NY","Intern","PepsiCo","The lab that I worked in had a good vibe, everyone was very motivated and worked to make sure that I succeeded in the program.","With such a large company, it's hard to see opportunities for personal growth. However, if you work hard and do well ideally you will be rewarded.",4,4,"Indra K. Nooyi","Chairman and CEO",869,74,26
"50",6756,"Abercrombie & Fitch","www.abercrombie.com",TRUE,FALSE,"Department, Clothing, & Shoe Stores",2551,"https://media.glassdoor.com/sqll/6756/abercrombie-and-fitch-squarelogo.png",2.8,"OK","2.6","2.5","2.3","2.6","2.9","0.5",6110756,TRUE,"2015-03-13 09:36:37.847","Floor Model","Poughkeepsie, NY","Floor Model","Management is great, and a great work environment.","Easy job. Not much folding to be done, main focus is greeting and helping customers.","You must greet every customer who walks in. even messing up a little gets you in big trouble.",4,4,"Mike Jeffries","Chairman and CEO",1393,17,83
"51",220,"Eastman Kodak","www.kodak.com",TRUE,FALSE,"Consumer Products Manufacturing",421,"https://media.glassdoor.com/sqll/220/eastman-kodak-squarelogo.png",2.8,"OK","2.8","1.9","3.2","2.2","3.3","0.2",6056651,FALSE,"2015-03-05 14:17:08.787","Engineering Manager","Rochester, NY","Engineering Manager","Formerly one of the best, now struggling to be it again.","Good people, high ethics, professionalism, good engineering skills, people help each other more than compete with each other.","Struggling in today's markets, a shell of what it once was.  The top engineering talent has left to other opportunities, the people left are often the ""C""team.  Not being negative, just honest.",4,4,"Jeffrey J. Clarke","Chief Executive Officer",23,21,79
"52",802,"Cablevision Systems","www.cablevision.com",TRUE,FALSE,"Cable, Internet & Telephone Providers",375,"https://media.glassdoor.com/sqll/802/cablevision-systems-squarelogo.png",3,"OK","2.9","2.5","3.9","2.9","3.0","0.6",6078406,TRUE,"2015-03-09 05:43:32.087","Project Manager","Syosset, NY","Project Manager","Good company to work","Has great benefits, free cable, match 401k. Depending on the building you work is very relaxing dress code.","Company change goals too much, sometimes it seems upper management does not have a clear view of the future.",4,4,"James L. Dolan","President, CEO, and Director;  Chairman, Madison Square Garden; and Governor, New York Knicks",216,45,55
"53",4608,"Edelman","www.edelman.com",TRUE,FALSE,"",1018,"https://media.glassdoor.com/sqll/4608/edelman-squarelogo.png",4,"Satisfied","4.2","3.9","3.7","4.2","3.5","0.9",5836742,FALSE,"2015-02-02 20:53:33.687","Vice President","New York, NY","Vice President","An amazing growth experience","Smart people, ethical management, care about doing the right thing.","Compensation a little low, fast paced (like any PR agency), may be letting things slip a little as they get bigger.",5,5,"Richard W. Edelman","President and CEO",812,95,5
"54",14465,"Bloomingdale's","www.bloomingdales.com",FALSE,FALSE,"Department, Clothing, & Shoe Stores",627,"https://media.glassdoor.com/sqll/14465/bloomingdale-s-squarelogo-1424979418986.png",2.9,"OK","2.8","2.5","3.0","2.4","2.9","0.5",6043135,TRUE,"2015-03-04 05:04:59.497","Sales Professional","New York, NY","Sales Professional","Great enviorment","Amazing manager
Plenty chances to grow within the company
Great staff","Commission is ok but the returns make it hard to see any commission",5,5,"Tony Spring","CEO",80,67,33
"55",9079,"Google","www.google.com",FALSE,FALSE,"Internet",3110,"https://media.glassdoor.com/sqll/9079/google-squarelogo-1411597920988.png",4.4,"Very Satisfied","4.4","3.9","4.4","4.0","4.0","0.9",4910922,TRUE,"2014-09-04 21:52:37.447","Software Engineer","Sea Cliff, NY","Software Engineer","Great place to work!","Freebies and free food. Decent Salary","Contractors get paid more than FTEs",4,4,"Larry Page","Co-Founder & CEO",1718,97,3
"56",9331,"BlackRock","www.blackrock.com",FALSE,FALSE,"Investment Banking & Asset Management",759,"https://media.glassdoor.com/sqll/9331/blackrock-squarelogo.png",3.4,"OK","3.6","3.3","3.4","3.3","3.1","0.7",5987639,FALSE,"2015-02-24 08:56:41.977","Associate","New York, NY","Associate","Associate - Client Service","Worked with bright, motivated people","Competitive and intense, lots of overhead",4,4,"Laurence D. Fink","Chairman and CEO",529,91,9
"57",3042,"Wegmans Food Markets","www.wegmans.com",TRUE,FALSE,"Grocery Stores & Supermarkets",573,"https://media.glassdoor.com/sqll/3042/wegmans-squarelogo.png",3.8,"Satisfied","4.1","3.2","3.6","3.5","3.6","0.8",6009916,TRUE,"2015-02-27 06:11:11.897","Employee","Rochester, NY",NA,"Very accommodating managers, great group of people.","The people are great, from managers to HR to fellow employees. You can tell Wegmans puts a lot of work into hiring good customer-focused people. The managers make you feel at home from day one. Free food sometimes and other occasional perks.","Managers move to other stores regularly. Tough to work nights. You might expect to get paid a bit more at Wegmans, but pay is average for the job.",4,4,"Danny Wegman","Chairman and CEO",405,88,12
"58",1762,"Paychex","www.paychex.com",TRUE,FALSE,"Staffing & Outsourcing",737,"https://media.glassdoor.com/sqll/1762/paychex-squarelogo.png",3.6,"Satisfied","3.8","3.6","3.5","3.6","3.7","0.7",6062122,TRUE,"2015-03-06 06:56:42.997","IT Engineer","Rochester, NY","IT Engineer","Your happiness may depend upon the group you work for","If you're in the right group it can be very rewarding, with competitive pay and wonderful co-workers.","There are groups that have an incredible amount of pressure on them, and they seem stuck in a culture of deflecting and delaying over serving the teams they interact with.",4,4,"Martin Mucci","President and CEO",330,90,10
"59",114118,"The Gap","www.gap.com",TRUE,FALSE,"Department, Clothing, & Shoe Stores",1935,"https://media.glassdoor.com/sqll/114118/the-gap-squarelogo-1424386386836.png",3.6,"Satisfied","3.9","3.1","3.3","3.2","3.5","0.7",6070362,FALSE,"2015-03-07 12:17:39.567","Assistant Merchandiser","New York, NY","Assistant Merchandiser","The best brand to work for.","The friendliest work environment possible. Great leadership, perfect work-life balance, and lots of growth opportunities.","I truthfully cannot find any cons about working for this company.",5,5,"Art Peck","CEO",24,87,13
"60",277,"GE","www.ge.com",TRUE,FALSE,"Energy",2923,"https://media.glassdoor.com/sqll/277/ge-squarelogo-1414093293132.png",3.7,"Satisfied","3.6","3.2","3.5","3.7","3.4","0.8",6036411,FALSE,"2015-03-03 09:43:52.12","AREA SALES MANAGER","New York, NY","AREA SALES MANAGER","Good company to work for","coworkers worked well together good benefits","downsizing. company and depts. constantly changing gears",4,4,"Jeffrey R. Immelt","Chairman & CEO",1198,86,14
"61",2937,"Polo Ralph Lauren","www.ralphlauren.com",FALSE,FALSE,"Consumer Products Manufacturing",519,"https://media.glassdoor.com/sqll/2937/polo-ralph-lauren-squarelogo.png",3.2,"OK","3.3","2.8","2.9","3.0","3.1","0.6",6104143,FALSE,"2015-03-12 10:25:23.937","Sales Associate/Cashier","Central Valley, NY","Sales Associate/Cashier","Nice atmosphere","The discount is very good, and it gets better around holiday season. You get a good amount of hours. They accomodate your scheduling needs with no problems. Small raise after about 3-4 months. If you set your availablitily for weekends, you will definately be working weekends.","Sometimes push you to bother customers ultiple time which I was uncomfrtable with.",4,4,"Ralph Lauren","Chairman and CEO",309,88,12
"62",415,"Lowe's","www.lowes.com",TRUE,FALSE,"Home Centers & Hardware Stores",5148,"https://media.glassdoor.com/sqll/415/lowe-s-squarelogo.png",3.4,"OK","3.3","2.9","3.4","3.3","3.0","0.7",5946961,FALSE,"2015-02-18 15:40:45.92","Assistant Store Manager","Brooklyn, NY","Assistant Store Manager","asm","Great company to work for many opportunities to grow..benefits are also great.","These are big box retailers so you are dealing with maybe 1500 customers per day double that on holidays. This will keep you busy throughout your shift. Customer can sometimes be very rude.",5,5,"Robert A. Niblock","Chairman and CEO",1972,70,30
"63",67,"Avon Products","www.avon.com",FALSE,FALSE,"Consumer Products Manufacturing",689,"https://media.glassdoor.com/sqll/67/avon-products-squarelogo-1397063164816.png",3,"OK","3.2","2.3","3.0","2.6","3.2","0.4",6099049,TRUE,"2015-03-11 16:24:37.127","Director","New York, NY","Director","Great company for women struggling to survive","The company's commitment to breast cancer, domestic violence and empowering women is the reason to work here.","Avon's business is on the decline and despite a new CEO and a turnaround plan, the company is struggling -- especially in North America. Layoffs occur at least one a year.",3,3,"Sheri S. McCoy","CEO",174,51,49
"64",41322,"US Army","www.army.mil",FALSE,FALSE,"Federal Agencies",6939,"https://media.glassdoor.com/sqll/41322/us-army-squarelogo.png",3.9,"Satisfied","3.9","3.0","4.2","4.0","2.8","0.8",6059251,FALSE,"2015-03-05 19:10:42.773","Intelligence Analyst","Fort Drum, NY","Intelligence Analyst","I served four years in the United States Army as an Intelligence Analyst. It was an honor to serve.","It was a challenging job that requires soldiers to take initiative, and always demanding. Soldiers develop a great sense of community and comradery with fellow soldiers which makes it unforgettable.","Demanding work with a very strong bureaucratic structure. It is easy to get caught up in the ""hurry up and wait"" mentality, because much of it stateside is maintenance-based.",4,4,"John McHugh","Secretary",2202,75,25
"65",30287,"S&P Ratings","www.standardandpoors.com",TRUE,FALSE,"Financial Analytics & Research",293,"https://media.glassdoor.com/sqll/30287/s-and-p-ratings-squarelogo-1390940398410.png",3.1,"OK","3.0","2.4","3.3","2.8","3.8","0.5",5509537,FALSE,"2014-12-09 14:13:29.787","Business Development","New York, NY","Business Development","Great company.  Unfortunately, they have been going through reductions in staff.","Many products to sell and a great brand name.  I sold company data and international securities identifiers.","Too much turnover lately.  Company values have gone done on personal levels.",4,4,"Neeraj Sahai","President",33,47,53
"66",40260,"Viacom","www.viacom.com",FALSE,FALSE,"Motion Picture Production & Distribution",259,"https://media.glassdoor.com/sqll/40260/viacom-squarelogo.png",3.7,"Satisfied","3.9","3.2","3.1","3.3","3.7","0.8",6064537,FALSE,"2015-03-06 12:00:50.183","Intern","New York, NY","Intern","Very impressed","The environment is warm and all of the employees I've met were welcoming and kind. In this fast paced industry, Viacom gets the job done. 
The internship program is one of the best I've seen.","Because it's such a big company, it might be difficult to connect with supervisors, and you may just be a number.",5,5,"Philippe P. Dauman","President, CEO, and Director",130,78,22
"67",121521,"NYU Langone Medical Center","www.med.nyu.edu",TRUE,FALSE,"Health Care Services & Hospitals",246,"https://media.glassdoor.com/sqll/121521/nyu-langone-medical-center-squarelogo-1389800173762.png",3.5,"Satisfied","3.2","3.0","3.5","3.1","3.6","0.7",6027101,TRUE,"2015-03-02 07:15:39.137","Student Intern","New York, NY","Student Intern","Good company","Young staff, flexible hours, not horrible pay for the amount of work I put in","not too many, it's a good place to work part-time as a student. a little annoying that you can't get email from your phone.",4,4,"Robert I. Grossman","Dean & CEO",80,83,17
"68",37984,"Sears","www.searshc.com",FALSE,FALSE,"Department, Clothing, & Shoe Stores",4691,"https://media.glassdoor.com/sqll/37984/sears-squarelogo.png",2.5,"OK","2.5","2.2","2.2","2.4","2.8","0.3",6105910,TRUE,"2015-03-12 14:10:24.63","Design Intern","New York, NY","Design Intern","As an intern, I loved coming to work everyday","Location
Work-life balance
professional/personal growth
relax atmosphere
Training
Internship Workshops","the position was only seasonal.",4,4,"Edward S. Lampert","Chairman of the Board, Chief Executive Officer",1071,21,79
"69",1909,"Staples","www.staples.com",FALSE,FALSE,"Office Supply Stores",2403,"https://media.glassdoor.com/sqll/1909/staples-squarelogo-1389034504432.png",2.9,"OK","2.9","2.6","2.7","2.8","3.0","0.4",6054928,TRUE,"2015-03-05 11:38:07.77","Staples Easy Tech","New York, NY","Staples Easy Tech","I work mainly with software issues and very knowledgeable  with systems.","I like learning about new technology and innovations.","I can only work part time here.",5,5,"Ron Sargent","Chairman and CEO",1252,47,53
"70",167,"CA Technologies","www.ca.com",FALSE,FALSE,"Computer Hardware & Software",1121,"https://media.glassdoor.com/sqll/167/ca-technologies-squarelogo-1403882544970.png",3.3,"OK","3.2","2.8","3.7","3.0","3.6","0.6",6084517,TRUE,"2015-03-09 18:58:19.103","Principal","Islandia, NY","Principal","Strong company heading in the right direction","Great culture and atmosphere, work place environment, strong emphasis on personal development and growth","Constant change, upward growth not always there, senior positions usually filled from outside.",4,4,"Michael P. Gregoire","CEO",377,77,23
"71",613,"AT&T","www.att.com",TRUE,FALSE,"Telecommunications Services",6876,"https://media.glassdoor.com/sqll/613/at-and-t-squarelogo.png",3.3,"OK","3.1","2.7","3.8","3.1","2.9","0.6",6113884,TRUE,"2015-03-13 18:35:47.86","AT&T Mobility RSC","Albany, NY","AT&T Mobility RSC","A great place to be in wireless","AT&T helped me grow as a person with good pay, paid time off and 401.  There is a constant amount of training to keep you fully up on the latest in consumer tech.  Company provided devices are great to learn on.  The company is transitioning to a leadership position in the internet of things and you'll see quite a few cool things working there.","The hours are long, especially for the frontlines.  Turnover can create interesting challenges in small stores.  So many things to sell with new product launches can get overwhelming.  It's difficult to get promoted without making Summit.",4,4,"Randall L. Stephenson","Chairman and CEO",3191,71,29
"72",2893,"McKinsey & Company","www.mckinsey.com",TRUE,FALSE,"Accounting",1127,"https://media.glassdoor.com/sqll/2893/mckinsey-and-company-squarelogo.png",4.2,"Very Satisfied","4.1","3.8","4.1","4.3","2.9","0.9",5726778,TRUE,"2015-01-19 09:05:39.657","Engagement Manager","New York, NY","Engagement Manager","Great place to learn with a great network, but can burn out quickly","Collegiate environment, smart people, interesting projects, access to senior management","Long hours, constant travel, constantly jumping from one project to next",5,5,"Dominic Barton","Managing Director",626,97,3
"73",2963,"Saks Fifth Avenue","www.careersatsaks.com",FALSE,FALSE,"Department, Clothing, & Shoe Stores",517,"https://media.glassdoor.com/sqll/2963/saks-fifth-avenue-squarelogo.png",2.9,"OK","2.7","2.4","2.8","2.5","2.9","0.4",5891731,FALSE,"2015-02-10 15:08:55.037","Stock Associate","New York, NY","Stock Associate","Not much of a chance to advance within the company","Very flexible with the schedule","Expect to much for what they pay, If they see you work hard they'll just take advantage of you and put way more on your plate compared to others, Lack respect towards employee's very bad way of talking to them , and you have to keep an eye on your hours, pay, and p.t.o ( paid time off ) as they tend to mess a lot with these.",3,3,"Marigay McKee","President",60,64,36
"74",136156,"Century 21 Department Stores","www.c21stores.com",FALSE,FALSE,"Department, Clothing, & Shoe Stores",211,"https://media.glassdoor.com/sqll/136156/century-21-department-stores-squarelogo.png",2.2,"Dissatisfied","2.3","2.1","2.0","2.3","2.3","0.2",5845255,FALSE,"2015-02-04 02:00:39.707","Sales Cashier","Brooklyn, NY","Sales Cashier","Cashier","Meet new feiends
Hours
Discount
Work activity 
Area","Low pay
Treat worker like criminal 
Hire to fire people 
Some supervisor not nice and talk down 
Short break",4,4,"Raymond Gindi","CEO",113,40,60
"75",3012,"UPS","www.ups.com",TRUE,FALSE,"Logistics & Supply Chain",3216,"https://media.glassdoor.com/sqll/3012/ups-squarelogo.png",3.5,"Satisfied","3.2","2.9","3.7","3.3","3.1","0.6",6061321,TRUE,"2015-03-06 04:37:04.923","Hub Supervisor","Uniondale, NY","Hub Supervisor","Awesome place to work","integrity and customer focus is a tradition","IT takes too long to advance.",3,3,"David Abney","Chief Executive Officer",262,74,26
"76",13661,"Ogilvy & Mather","www.ogilvy.com",FALSE,FALSE,"Advertising & Marketing",421,"https://media.glassdoor.com/sqll/13661/ogilvy-and-mather-squarelogo.png",3.6,"Satisfied","3.7","2.9","3.0","3.2","3.2","0.7",6078215,FALSE,"2015-03-09 04:38:00.653","Associate Consultant","New York, NY","Associate Consultant","Friendly environment with helpful staff","large organization with useful resources and efficient team members, learned a lot from working there!","your voice could get lost when so many people are involved in one project",4,4,"Miles Young","Global CEO",213,80,20
"77",33759,"SUNY Buffalo","www.buffalo.edu",FALSE,FALSE,"Colleges & Universities",202,"https://media.glassdoor.com/sqll/33759/suny-buffalo-squarelogo.png",4.1,"Very Satisfied","3.8","3.5","3.5","3.5","3.9","0.9",6037901,FALSE,"2015-03-03 12:23:36.72","Research Assistant","Buffalo, NY","Research Assistant","Good atmosphere and fast paced","This place has very good atmosphere . People are very friendly. The boss like a friend ofter talk to you","The weather in winter is not good. We have clean snow all the time in the whole winter. And also we have to work onsite during the big storm.",5,5,"Satish K. Tripathi","President",72,92,8
