"","employers.id","employers.name","employers.website","employers.isEEP","employers.exactMatch","employers.industry","employers.numberOfRatings","employers.squareLogo","employers.overallRating","employers.ratingDescription","employers.cultureAndValuesRating","employers.seniorLeadershipRating","employers.compensationAndBenefitsRating","employers.careerOpportunitiesRating","employers.workLifeBalanceRating","employers.recommendToFriendRating","employers.featuredReview.id","employers.featuredReview.currentJob","employers.featuredReview.reviewDateTime","employers.featuredReview.jobTitle","employers.featuredReview.location","employers.featuredReview.jobTitleFromDb","employers.featuredReview.headline","employers.featuredReview.pros","employers.featuredReview.cons","employers.featuredReview.overall","employers.featuredReview.overallNumeric","employers.ceo.name","employers.ceo.title","employers.ceo.numberOfRatings","employers.ceo.pctApprove","employers.ceo.pctDisapprove"
"78",11806,"Verizon Wireless","www.verizonwireless.com",TRUE,FALSE,"Telecommunications Services",3557,"https://media.glassdoor.com/sqll/11806/verizon-wireless-squarelogo-1406225518115.png",3.3,"OK","3.2","2.8","4.1","3.2","2.7","0.6",6055146,TRUE,"2015-03-05 11:44:31.88","Wireless Consultant","Syracuse, NY","Wireless Consultant","Verizon has an exceptional training program that helps people of all skills control how successful they are.","It is an awesome place to meet new people and learn to better interact with people of all demographics. There is longevity when selling something that EVERYONE NEEDs. Verizon Wireless is the number one rated wireless network in the USA.","It is very difficult to get promoted to an RD position in Verizon Wireless. The hours are long, especially on holidays.  When dealing with sales, paid vacation is rare and not worth taking too much time away from the money.",5,5,"Daniel Mead","President & CEO",1728,74,26
"79",2785,"Estée Lauder Companies","www.elcompanies.com",FALSE,FALSE,"Consumer Products Manufacturing",323,"https://media.glassdoor.com/sqll/2785/estee-lauder-squarelogo.png",3.6,"Satisfied","3.7","3.3","3.5","3.3","3.5","0.7",6121545,TRUE,"2015-03-15 12:54:42.667","Digital Marketing Coordinator","New York, NY","Digital Marketing Coordinator","Good overall experience","Motivated employees, surrounded by smart people","not a great work life balance",4,4,"Fabrizio Freda","President, CEO, and Director",161,91,9
"80",21435,"United Nations","www.un.org",FALSE,FALSE,"Federal Agencies",320,"https://media.glassdoor.com/sqll/21435/united-nations-squarelogo.png",3.7,"Satisfied","3.9","3.1","3.3","3.0","4.0","0.7",6097581,TRUE,"2015-03-11 12:23:14.357","Intern","New York, NY","Intern","Internship Experience","Highly competent co-workers, extremely friendly and diverse staff. Everyone was very willing to expose you to different areas of the office and the projects they are working on.","Work load and pace was slower than I would have liked, but summer is a slower time of year for the office.",4,4,"Ban Ki-moon","Secretary-General",173,79,21
"81",13635,"HBO","www.hbo.com",FALSE,FALSE,"TV Broadcast & Cable Networks",199,"https://media.glassdoor.com/sqll/13635/hbo-squarelogo.png",3.8,"Satisfied","3.6","3.2","3.7","3.0","4.0","0.8",6089053,FALSE,"2015-03-10 10:20:43.063","Intern","New York, NY","Intern","Couldn't have asked for a better internship.","HBO's internship program is very structured and involves lots of great networking/learning opportunities, including speaker series with execs and a summer-long project that all the interns work on together. There were 50 interns in NYC, all spread out throughout many departments. My manager was incredibly clear, approachable, and helpful, and gave me plenty of meaningful work to do. From what I've heard, most other interns had similar experiences. HBO also pays interns quite well by entertainment industry standards - $15/hr.","Virtually none. I wasn't a huge fan of ""Project HBO,"" the intern project we all worked on (didn't always seem like a meaningful use of time), but everything else was great.",5,5,"Richard Plepler","CEO",61,90,10
"82",11303,"Moody's","www.moodys.com",FALSE,FALSE,"Financial Analytics & Research",237,"https://media.glassdoor.com/sqll/11303/moody-s-squarelogo.png",3.4,"OK","3.8","3.3","3.1","3.0","4.0","0.8",5836469,FALSE,"2015-02-02 20:10:40.813","Legal Intern","New York, NY","Legal Intern","Summer at Moody's","Working at Moody's was a great experience where I saw a variety of legal issues in a collegial, laid-back working environment. I particularly enjoyed it because I got along very well with my supervisor, which can't be guaranteed for everyone.","It seems like some of the analysts are looking to make moves to BBs and don't seem to want to stay at Moody's to develop their career there. A bit of office politics, and sometimes not fast-paced enough.",4,4,"Ray McDaniel Jr.","Chairman and CEO",126,80,20
"83",121522,"NewYork-Presbyterian Hospital","www.nyp.org",TRUE,FALSE,"Health Care Services & Hospitals",201,"https://media.glassdoor.com/sqll/121522/new-york-presbyterian-hospital-squarelogo-1389318576308.png",3.7,"Satisfied","3.5","3.1","3.8","3.5","3.5","0.7",6073067,FALSE,"2015-03-08 05:23:49.207","Volunteer","New York, NY","Volunteer","Rewarding place to volunteer","The hospital provides extensive training and orientation for volunteers so that they are very well prepared to handle almost anything.","I would not change a thing! The training and orientation are truly outstanding.",5,5,"Steven J. Corwin","CEO",63,80,20
"84",270,"GEICO","www.geico.com",TRUE,FALSE,"Insurance Carriers",1025,"https://media.glassdoor.com/sqll/270/geico-squarelogo-1378217597358.png",3.1,"OK","3.2","2.9","3.8","3.4","2.8","0.5",6021081,TRUE,"2015-03-01 06:26:18.507","Bodily Injury Claims Adjuster","Woodbury, NY","Bodily Injury Claims Adjuster","Great company","As long as your willing to work hard the opportunities for growth are there.","Only days of are standard Christmas, thanksgiving etc won't get other days such as MLK and other federal holidays but they do give you four floating holidays throughout the year to compensate.",4,4,"Olza (Tony) Nicely","Chairman and CEO",700,85,15
"85",2439,"Barnes & Noble","www.barnesandnoble.com",FALSE,FALSE,"Department, Clothing, & Shoe Stores",1273,"https://media.glassdoor.com/sqll/2439/barnes-and-noble-squarelogo.png",3.3,"OK","3.5","2.9","2.8","2.7","3.5","0.6",5971463,TRUE,"2015-02-22 09:55:35.52","Bookseller","Manhasset, NY","Bookseller","Great place to work","High Customer focus - Customers are always a priority and always come first.
Relaxed atmosphere - managers expect booksellers to complete daily tasks but never at the expense of the customer.
Intellectual customers - As a bookseller, I enjoy interacting with the B&N customer because most are above average and conversations are always interesting and stimulating.
Flexible hours - many different shifts are available to accommodate individual needs.  Also varying shifts make each day different and provide more variety to my week.  Management also supports and encourages a good work/life balance.
On-the-job training gets a newcomer involved immediately.  Co-worker support is stressed and part of the corporate culture.
Amazing benefits at the full time level (health care, vision, dental 401K).
Great discounts (books, cafe, bookseller appreciation around the holidays).
Upward mobility - fast promotions - a lot of opportunities for advancement.","Salary is not competitive.
Management is not consistent.  A bookseller can ask the same question to three different managers and get three different responses which is very confusing.
On-the-job training can be frustrating because of inconsistent management.  Also it is difficult to get the ""big picture"" because so much training is done at a very detailed level.  In addition, due to the upward mobility, managers are frequently transferred to different locations which adds to the management instability.",4,4,"Michael Huseby","CEO",197,59,41
"86",2899,"MetLife","www.metlife.com",TRUE,FALSE,"Insurance Carriers",1117,"https://media.glassdoor.com/sqll/2899/metlife-squarelogo.png",3.1,"OK","3.0","2.6","3.3","2.8","3.4","0.5",5711343,TRUE,"2015-01-16 09:27:17.71","Financial Services Representative","Long Is City, NY","Financial Services Representative","Great company with lots of opportunities.","Brand recognition, lots of ways to learn, grow. Decent support from management team(depends on which MD you are with)","Technology, IT sucks. Sales pressure(but, reasonable), conservative company culture.",4,4,"Steven A. Kandarian","President & CEO",375,68,32
"87",13361,"Forever 21","www.forever21.com",FALSE,FALSE,"Department, Clothing, & Shoe Stores",1705,"https://media.glassdoor.com/sqll/13361/forever-21-squarelogo-1418155223553.png",2.5,"OK","2.3","2.1","2.0","2.5","2.5","0.3",6116976,TRUE,"2015-03-14 11:58:34.267","Stock Associate","New York, NY","Stock Associate","Forever 21","No hours in the store because this is a new location. They same to have favorites there also .......","Great people.and the girls are nice looking. IF your a young man and can't get a girl working at forever 21 you just dint want one",3,3,"Do Won ""Don"" Chang","Co-Founder and CEO",702,29,71
"88",13903,"Victoria's Secret Stores","www.victoriassecret.com",FALSE,FALSE,"Department, Clothing, & Shoe Stores",1848,"https://media.glassdoor.com/sqll/13903/victoria-s-secret-stores-squarelogo.png",3.3,"OK","3.6","3.0","3.0","3.1","2.9","0.6",5660054,TRUE,"2015-01-08 18:37:55.28","Administrator","New York, NY","Administrator","Greatttt company - seems promising for more opportunities","The company and company atmosphere is awesome. Everyone has and knows their job so there's no confusion. I like the organization and the fact that the stress level of the employees are low and so are attitudes. Everyone is quite respectful.","The nature of the job itself - if considering this role is quite slow. You have some busy days and VERY slow moving days. Hopefully you're the mind of person who values down time because it could be frustrating, surprisingly.",5,5,"Sharen Turney","CEO",670,82,18
"89",3776,"Nielsen","www.nielsen.com",TRUE,FALSE,"Research & Development",1404,"https://media.glassdoor.com/sqll/3776/the-nielsen-company-squarelogo.png",3.4,"OK","3.2","2.9","3.0","3.3","3.1","0.6",5898027,TRUE,"2015-02-11 11:27:26.193","Vice President","New York, NY","Vice President","Scary smart, charismatic and motivated colleagues.","Nielsen really cares about providing value to its clients.  It is NOT about billing.  The culture is, ""If the work adds differentiated value, new work follows."" All levels of the organization get client interaction and the project teams encourage active participation from all team members - no matter what level they're at.  Teams are lean, so there is a lot of delegating, which provides ample opportunities to learn and stand apart from your peers.  Work life balance is tough - hours can be long, but they are flexible. Colleagues can work from home, take a day off, etc... as long as the work gets done on time and with the necessary content.  Sr. Leadership is brilliant and focused on growing the overall business.","Salaries are low vs. comparable roles at a client organization or with other consulting firms.  Bonuses are stupid low.  Embarrassingly low.  Despite being a publicly traded company, there is no stock option plan or employee purchase plan for anyone other than the very, very select top management team.  As a result of this, there is a high turnover as more lucrative offers are very easy to come by. 

With numerous verticals (lines of business) it is difficult to gain cross-functional experience, as there is a strong push to keep people in one vertical, rather than move them and have to train them on new things.",4,4,"Mitch Barns","Chief Executive Officer",230,80,20
"90",565,"Rite Aid","www.riteaid.com",FALSE,FALSE,"Drug & Health Stores",1137,"https://media.glassdoor.com/sqll/565/rite-aid-squarelogo.png",2.7,"OK","2.7","2.4","2.6","2.6","2.8","0.4",6055627,TRUE,"2015-03-05 12:41:33.64","Shift Supervisor","New Paltz, NY","Shift Supervisor","Shift Supervisor","-Detailed training when you first start that continues monthly
-Good working environment
-Opportunity to collaborate with other employees on projects","-Schedule changes from week to week
-Have to work days, nights and weekends
-Hard to get time off",3,3,"John T. Standley","President, CEO, and Director",435,53,47
"91",14976,"AllianceBernstein","www.alliancebernstein.com",FALSE,FALSE,"Investment Banking & Asset Management",224,"https://media.glassdoor.com/sqll/14976/alliancebernstein-squarelogo.png",3.1,"OK","2.9","2.4","2.7","2.4","3.4","0.4",5808138,FALSE,"2015-01-29 12:32:54.087","Senior Designer","New York, NY","Senior Designer","Great Place to work","At alliance Bernstein, there is a strong demand for high quality design. Really great team of creative individuals. And you truly get to own the design process from start to finish.","The biggest challenge is the physical distance between the creative individuals. So the communication between the creative and management tends to default into email response.",4,4,"Peter S. Kraus","Chairman and CEO",118,48,52
"92",11385,"JetBlue","www.jetblue.com",FALSE,FALSE,"Transportation Management",333,"https://media.glassdoor.com/sqll/11385/jetblue-squarelogo.png",3.8,"Satisfied","4.0","3.2","3.3","3.5","3.5","0.8",6076155,TRUE,"2015-03-08 17:48:30.613","Employee","Long Island City, NY",NA,"Great company","Great company with a friendly and outgoing culture.  
Leadership is available and easy to get in touch with.  Encourage open discussion and teamwork.  Good benefits.","The pay is low.  Flexible work arrangements available, but depend on department availability and leadership approval.   Headquarters in Long Island City isnt easily accessible",4,4,"Dave Barger","President & CEO",258,88,12
"93",33757,"Stony Brook University","www.stonybrook.edu",FALSE,FALSE,"Colleges & Universities",197,"https://media.glassdoor.com/sqll/33757/stony-brook-squarelogo.png",3.8,"Satisfied","3.5","3.3","3.3","3.4","3.7","0.8",6021968,TRUE,"2015-03-01 10:08:13.637","Teaching Assistant","Stony Brook, NY","Teaching Assistant","School is great, but a typical state school problem. Big campus, not so much fund for r&d","Environment is beautiful, nice and quiet. Two hours train ride to get to the city which is relatively convenient. Workers here are friendly and they work hard.","Not strong connection with other schools, no strong cooperation with industry.",4,4,"Samuel L. Stanley Jr., M.D.","President",58,86,14
"94",32824,"TransPerfect","www.transperfect.com",FALSE,FALSE,"Consulting",317,"https://media.glassdoor.com/sqll/32824/transperfect-translations-squarelogo.png",2.6,"OK","2.5","2.3","2.2","2.6","2.3","0.4",5832779,FALSE,"2015-02-02 11:26:20.54","Translator","New York, NY","Translator","Good for work opportunities, but no benefits...","Access to big, long-term projects; opportunities for overtime; good entry-level pay.","No proactive offerings of salary increases or other benefits to contract workers, even for those working on long-term projects (projects lasting more than a year). Managers are sometimes unprofessional.",3,3,"Elizabeth Elting","Co-CEO",142,41,59
"95",8014,"Cognizant Technology Solutions","www.cognizant.com",FALSE,FALSE,"IT Services",6644,"https://media.glassdoor.com/sqll/8014/cognizant-technology-solutions-squarelogo.png",3.6,"Satisfied","3.4","3.0","3.0","3.4","3.2","0.8",6056251,TRUE,"2015-03-05 13:40:12.497","SAN Administrator","New York, NY","SAN Administrator","Great Company to Work for","Very good client count.and great opportunities","Promotion takes time.Needs good repo with a manager",4,4,"Frank D'Souza","President & CEO",4512,93,7
"96",4276,"L'Oréal USA","www.lorealusa.com",TRUE,FALSE,"Consumer Products Manufacturing",353,"https://media.glassdoor.com/sqll/4276/l-oréal-usa-squarelogo-1404841384823.png",3.2,"OK","2.9","2.8","3.5","3.2","2.4","0.6",5869066,FALSE,"2015-02-07 06:29:05.163","Sales Operations Intern","New York, NY","Sales Operations Intern","Fun company and great experience.","It's a fun, but hardworking atmosphere. Everyone is really invested in their job.","You may come across a few people who are difficult to work with.",5,5,"Frederic Roze","President and CEO",169,73,27
"97",23545,"RIT (Rochester Institute of Technology)","www.rit.edu",FALSE,FALSE,"Colleges & Universities",191,"https://media.glassdoor.com/sqll/23545/rit-rochester-institute-of-technology-squarelogo.png",4.2,"Very Satisfied","4.1","3.7","3.5","3.4","3.9","0.9",6064312,TRUE,"2015-03-06 11:35:57.25","Assistant Systems Administrator","Rochester, NY","Assistant Systems Administrator","Great work experience for co-ops","Learning pretty much anything that you want to learn about as a co-op, and you get put in charge of actual labs and computers.  In addition, you are given responsibilities that truly prepare you for a full time job when you graduate","Sometimes there isn't much to do.  If nothing is breaking, then you are left to figure out something productive to do on your own.  For me, this was a con as often what I thought about was far out of my league.",5,5,"William W. Destler","President",110,98,2
"98",960,"New York Times","www.nytimes.com",FALSE,FALSE,"Motion Picture Production & Distribution",170,"https://media.glassdoor.com/sqll/960/new-york-times-squarelogo.png",3.5,"Satisfied","3.7","2.6","3.4","3.0","3.9","0.7",5963277,TRUE,"2015-02-20 17:58:53.27","Digital Designer","New York, NY","Digital Designer","Great workplace","Lots of really smart and interesting people. everyone operates at a very high level","Lots of challenges in media companies these days",5,5,"Mark Thompson","President & CEO",33,76,24
"99",3729,"University of Rochester","www.rochester.edu",FALSE,FALSE,"Colleges & Universities",181,"https://media.glassdoor.com/sqll/3729/university-of-rochester-squarelogo.png",3.8,"Satisfied","3.6","3.3","3.5","3.5","3.8","0.9",6105129,TRUE,"2015-03-12 12:21:27.02","PhD Candidate","Rochester, NY","PhD Candidate","Graduate student in Optics","Program is awesome. They treat their grad students in optics really well. They have a stipend that is better then many other engineering/science programs.","They are a University so they have their issues. Mostly administration stuff. Occasionally have to fill out carbon copy forms which is ridiculous to me considering the other options we know have available.",4,4,"Joel Seligman","President",103,80,20
"100",2823,"Hearst Corporation","www.hearst.com",FALSE,FALSE,"Motion Picture Production & Distribution",237,"https://media.glassdoor.com/sqll/2823/hearst-corporation-squarelogo.png",3.5,"Satisfied","3.3","3.1","3.0","3.1","3.4","0.7",6081432,TRUE,"2015-03-09 11:59:08.807","Photo Intern","New York, NY","Photo Intern","Nice, but reserved.","Almost every is nice and willing to answer questions.","There isn't a lot of employee mingling. There is zero communication between magazines and very little between teams within a specific magazine.",5,5,"Frank A. Bennack Jr.","Vice Chairman and Interim CEO",70,82,18
